mariia@ms-zen14:~$ sudo tcpdump -i wlo1 port 53
tcpdump: verbose output suppressed, use -v[v]... for full protocol decode
listening on wlo1, link-type EN10MB (Ethernet), snapshot length 262144 bytes
13:18:27.235981 IP ms-zen14.53433 > gbcumb01.gbc.local.domain: 53591+ [1au] HTTPS? splendidyoungquietkiss.neverssl.com. (64)
13:18:27.236133 IP ms-zen14.48959 > gbcumb01.gbc.local.domain: 50938+ [1au] A? splendidyoungquietkiss.neverssl.com. (64)
13:18:27.247941 IP ms-zen14.56060 > gbcumb01.gbc.local.domain: 41829+ [1au] HTTPS? safebrowsing.google.com. (52)
13:18:27.248147 IP ms-zen14.42687 > gbcumb01.gbc.local.domain: 64440+ [1au] A? safebrowsing.google.com. (52)
13:18:27.252496 IP gbcumb01.gbc.local.domain > ms-zen14.53433: 53591 0/0/1 (64)
13:18:27.254012 IP gbcumb01.gbc.local.domain > ms-zen14.56060: 41829 0/0/1 (52)
13:18:27.254013 IP gbcumb01.gbc.local.domain > ms-zen14.42687: 64440 5/0/1 CNAME sb.l.google.com., A 142.250.139.190, A 142.250.139.91, A 142.250.139.93, A 142.250.139.136 (135)
13:18:27.264494 IP gbcumb01.gbc.local.domain > ms-zen14.48959: 50938 1/0/1 A 34.223.124.45 (80)
13:18:27.274194 IP ms-zen14.33072 > gbcumb01.gbc.local.domain: 37814+ [1au] PTR? 217.80.10.10.in-addr.arpa. (54)
13:18:27.278632 IP gbcumb01.gbc.local.domain > ms-zen14.33072: 37814 1/0/1 PTR gbcumb01.gbc.local. (86)
13:18:27.279516 IP ms-zen14.40164 > gbcumb01.gbc.local.domain: 57039+ [1au] PTR? 70.97.0.10.in-addr.arpa. (52)
13:18:27.282643 IP gbcumb01.gbc.local.domain > ms-zen14.40164: 57039 NXDomain 0/1/1 (111)
13:18:31.279845 IP ms-zen14.46169 > gbcumb01.gbc.local.domain: 20617+ [1au] HTTPS? ssl.gstatic.com. (44)
13:18:31.286252 IP gbcumb01.gbc.local.domain > ms-zen14.46169: 20617 0/0/1 (44)
13:18:31.325489 IP ms-zen14.34246 > gbcumb01.gbc.local.domain: 56589+ [1au] HTTPS? optimizationguide-pa.googleapis.com. (64)
13:18:31.325624 IP ms-zen14.60836 > gbcumb01.gbc.local.domain: 3492+ [1au] A? optimizationguide-pa.googleapis.com. (64)
13:18:31.329343 IP gbcumb01.gbc.local.domain > ms-zen14.34246: 56589 0/0/1 (64)
13:18:31.332191 IP gbcumb01.gbc.local.domain > ms-zen14.60836: 3492 4/0/1 A 216.239.34.223, A 216.239.36.223, A 216.239.38.223, A 216.239.32.223 (128)
13:18:31.347180 IP ms-zen14.41323 > gbcumb01.gbc.local.domain: 15653+ [1au] HTTPS? pysquad.com. (40)
13:18:31.347348 IP ms-zen14.41697 > gbcumb01.gbc.local.domain: 30554+ [1au] A? pysquad.com. (40)
13:18:31.351556 IP gbcumb01.gbc.local.domain > ms-zen14.41323: 15653 0/0/1 (40)
13:18:31.443013 IP gbcumb01.gbc.local.domain > ms-zen14.41697: 30554 1/0/1 A 4.240.88.191 (56)
13:18:31.857274 IP ms-zen14.51821 > gbcumb01.gbc.local.domain: 42159+ [1au] HTTPS? www.geeksforgeeks.org. (50)
13:18:31.857426 IP ms-zen14.33236 > gbcumb01.gbc.local.domain: 18522+ [1au] A? www.geeksforgeeks.org. (50)
13:18:31.857523 IP ms-zen14.53654 > gbcumb01.gbc.local.domain: 56117+ [1au] HTTPS? assets.geeksforgeeks.org. (53)
13:18:31.857613 IP ms-zen14.43778 > gbcumb01.gbc.local.domain: 25692+ [1au] A? assets.geeksforgeeks.org. (53)
13:18:31.857707 IP ms-zen14.38895 > gbcumb01.gbc.local.domain: 60066+ [1au] HTTPS? fonts.gstatic.com. (46)
13:18:31.857792 IP ms-zen14.32951 > gbcumb01.gbc.local.domain: 18461+ [1au] A? fonts.gstatic.com. (46)
13:18:31.894450 IP ms-zen14.53760 > gbcumb01.gbc.local.domain: 48653+ [1au] HTTPS? drivefrontend-pa.clients6.google.com. (65)
13:18:31.894666 IP ms-zen14.58623 > gbcumb01.gbc.local.domain: 48260+ [1au] A? drivefrontend-pa.clients6.google.com. (65)
13:18:31.918771 IP gbcumb01.gbc.local.domain > ms-zen14.51821: 42159 0/0/1 (50)
13:18:31.918771 IP gbcumb01.gbc.local.domain > ms-zen14.32951: 18461 1/0/1 A 192.178.192.94 (62)
13:18:31.918772 IP gbcumb01.gbc.local.domain > ms-zen14.38895: 60066 0/0/1 (46)
13:18:31.918838 IP gbcumb01.gbc.local.domain > ms-zen14.53760: 48653 0/0/1 (65)
13:18:31.918838 IP gbcumb01.gbc.local.domain > ms-zen14.53654: 56117 0/0/1 (53)
13:18:31.918853 IP gbcumb01.gbc.local.domain > ms-zen14.58623: 48260 1/0/1 A 142.250.137.95 (81)
13:18:31.981655 IP gbcumb01.gbc.local.domain > ms-zen14.43778: 25692 5/0/1 CNAME d3tojzvpbuo41f.cloudfront.net., A 18.245.104.115, A 18.245.104.22, A 18.245.104.30, A 18.245.104.48 (160)
13:18:32.004427 IP gbcumb01.gbc.local.domain > ms-zen14.33236: 18522 5/0/1 CNAME d1t2f3swasxi04.cloudfront.net., A 18.67.17.67, A 18.67.17.19, A 18.67.17.38, A 18.67.17.45 (157)
13:18:32.265453 IP ms-zen14.38129 > gbcumb01.gbc.local.domain: 63013+ [1au] HTTPS? fonts.googleapis.com. (49)
13:18:32.265586 IP ms-zen14.36508 > gbcumb01.gbc.local.domain: 39740+ [1au] A? fonts.googleapis.com. (49)
13:18:32.280216 IP gbcumb01.gbc.local.domain > ms-zen14.38129: 63013 0/0/1 (49)
13:18:32.280310 IP gbcumb01.gbc.local.domain > ms-zen14.36508: 39740 1/0/1 A 142.250.139.95 (65)
13:18:32.648220 IP ms-zen14.37703 > gbcumb01.gbc.local.domain: 50883+ [1au] HTTPS? analytics.google.com. (49)
13:18:32.648365 IP ms-zen14.46129 > gbcumb01.gbc.local.domain: 37085+ [1au] A? analytics.google.com. (49)
13:18:32.648472 IP ms-zen14.41514 > gbcumb01.gbc.local.domain: 20769+ [1au] HTTPS? stats.g.doubleclick.net. (52)
13:18:32.648568 IP ms-zen14.39714 > gbcumb01.gbc.local.domain: 8817+ [1au] A? stats.g.doubleclick.net. (52)
13:18:32.648841 IP ms-zen14.43881 > gbcumb01.gbc.local.domain: 48722+ [1au] HTTPS? www.google.ca. (42)
13:18:32.648931 IP ms-zen14.57898 > gbcumb01.gbc.local.domain: 32541+ [1au] A? www.google.ca. (42)
13:18:32.684914 IP gbcumb01.gbc.local.domain > ms-zen14.46129: 37085 5/0/1 CNAME analytics-alv.google.com., A 216.239.38.181, A 216.239.32.181, A 216.239.34.181, A 216.239.36.181 (141)
13:18:32.684914 IP gbcumb01.gbc.local.domain > ms-zen14.57898: 32541 1/0/1 A 142.250.139.94 (58)
13:18:32.684944 IP gbcumb01.gbc.local.domain > ms-zen14.43881: 48722 0/0/1 (42)
13:18:32.684947 IP gbcumb01.gbc.local.domain > ms-zen14.37703: 50883 0/0/1 (49)
13:18:32.684949 IP gbcumb01.gbc.local.domain > ms-zen14.39714: 8817 4/0/1 A 64.233.178.155, A 64.233.178.156, A 64.233.178.157, A 64.233.178.154 (116)
13:18:32.684976 IP gbcumb01.gbc.local.domain > ms-zen14.41514: 20769 0/0/1 (52)
13:18:32.845829 IP ms-zen14.45287 > gbcumb01.gbc.local.domain: 47430+ [1au] HTTPS? fonts.googleapis.com. (49)
13:18:32.862185 IP ms-zen14.55953 > gbcumb01.gbc.local.domain: 55400+ [1au] HTTPS? fonts.gstatic.com. (46)
13:18:32.862411 IP ms-zen14.54530 > gbcumb01.gbc.local.domain: 48654+ [1au] HTTPS? storage.googleapis.com. (51)
13:18:32.862485 IP ms-zen14.59383 > gbcumb01.gbc.local.domain: 18210+ [1au] A? storage.googleapis.com. (51)
13:18:32.895981 IP ms-zen14.51474 > gbcumb01.gbc.local.domain: 18216+ [1au] HTTPS? utilapi.geeksforgeeks.org. (54)
13:18:32.896123 IP ms-zen14.32984 > gbcumb01.gbc.local.domain: 22278+ [1au] A? utilapi.geeksforgeeks.org. (54)
13:18:32.947826 IP gbcumb01.gbc.local.domain > ms-zen14.51474: 18216 0/0/1 (54)
13:18:32.947827 IP gbcumb01.gbc.local.domain > ms-zen14.54530: 48654 0/0/1 (51)
13:18:32.947900 IP gbcumb01.gbc.local.domain > ms-zen14.45287: 47430 0/0/1 (49)
13:18:32.947941 IP gbcumb01.gbc.local.domain > ms-zen14.55953: 55400 0/0/1 (46)
13:18:32.971084 IP gbcumb01.gbc.local.domain > ms-zen14.59383: 18210 3/0/1 A 142.250.139.207, A 192.178.192.207, A 142.250.137.207 (99)
13:18:33.008671 IP gbcumb01.gbc.local.domain > ms-zen14.32984: 22278 5/0/1 CNAME d19xzojil3t3u2.cloudfront.net., A 18.67.39.60, A 18.67.39.89, A 18.67.39.123, A 18.67.39.25 (161)
13:18:33.083485 IP ms-zen14.38449 > gbcumb01.gbc.local.domain: 54541+ [1au] HTTPS? fundingchoicesmessages.google.com. (62)
13:18:33.083662 IP ms-zen14.59732 > gbcumb01.gbc.local.domain: 18103+ [1au] A? fundingchoicesmessages.google.com. (62)
13:18:33.101554 IP ms-zen14.60883 > gbcumb01.gbc.local.domain: 53891+ [1au] HTTPS? media.geeksforgeeks.org. (52)
13:18:33.101697 IP ms-zen14.43795 > gbcumb01.gbc.local.domain: 25940+ [1au] A? media.geeksforgeeks.org. (52)
13:18:33.103000 IP gbcumb01.gbc.local.domain > ms-zen14.38449: 54541 0/0/1 (62)
13:18:33.109048 IP gbcumb01.gbc.local.domain > ms-zen14.59732: 18103 7/0/1 CNAME www3.l.google.com., A 142.250.137.102, A 142.250.137.113, A 142.250.137.138, A 142.250.137.139, A 142.250.137.100, A 142.250.137.101 (179)
13:18:33.109166 IP gbcumb01.gbc.local.domain > ms-zen14.60883: 53891 0/0/1 (52)
13:18:33.135515 IP gbcumb01.gbc.local.domain > ms-zen14.43795: 25940 5/0/1 CNAME d3qt53jevtbvi2.cloudfront.net., A 13.227.246.51, A 13.227.246.78, A 13.227.246.80, A 13.227.246.35 (159)
13:18:33.183472 IP ms-zen14.51160 > gbcumb01.gbc.local.domain: 6697+ [1au] HTTPS? www.googleadservices.com. (53)
13:18:33.183625 IP ms-zen14.55291 > gbcumb01.gbc.local.domain: 38103+ [1au] A? www.googleadservices.com. (53)
13:18:33.197335 IP ms-zen14.54294 > gbcumb01.gbc.local.domain: 24224+ [1au] HTTPS? googleads.g.doubleclick.net. (56)
13:18:33.197468 IP ms-zen14.57125 > gbcumb01.gbc.local.domain: 57243+ [1au] A? googleads.g.doubleclick.net. (56)
13:18:33.202266 IP gbcumb01.gbc.local.domain > ms-zen14.55291: 38103 4/0/1 A 142.250.139.155, A 142.250.139.156, A 142.250.139.157, A 142.250.139.154 (117)
13:18:33.202391 IP gbcumb01.gbc.local.domain > ms-zen14.51160: 6697 0/0/1 (53)
13:18:33.210066 IP gbcumb01.gbc.local.domain > ms-zen14.57125: 57243 4/0/1 A 192.178.192.157, A 192.178.192.154, A 192.178.192.155, A 192.178.192.156 (120)
13:18:33.210147 IP gbcumb01.gbc.local.domain > ms-zen14.54294: 24224 0/0/1 (56)
13:18:36.666430 IP ms-zen14.54620 > gbcumb01.gbc.local.domain: 25648+ [1au] HTTPS? ugprod.geeksforgeeks.org. (53)
13:18:36.666597 IP ms-zen14.44403 > gbcumb01.gbc.local.domain: 40188+ [1au] A? ugprod.geeksforgeeks.org. (53)
13:18:36.672646 IP gbcumb01.gbc.local.domain > ms-zen14.54620: 25648 0/0/1 (53)
13:18:36.731163 IP gbcumb01.gbc.local.domain > ms-zen14.44403: 40188 1/0/1 A 34.160.164.47 (69)
^C
86 packets captured
86 packets received by filter
0 packets dropped by
